1,Health Potion,Instantly heal for [value] health,heal,80,null,30,UISprites/HealthPotion
2,Stim,Increases your movement speed by [value] for [secValue] seconds,speed,30%,5,30,UISprites/Stim
3,Barrier,Gain a protective shield for [value] seconds,barrier,5,null,30,UISprites/Barrier
4,Overload,Increases your fire rate by [value] for [secValue] seconds,fireRate,50%,5,30,UISprites/Overload
5,Ocular HUD,Gain 100% CRIT CHANCE for [value] seconds,critChance,5,null,30,UISprites/OcularHud
6,Grenade,Tosses a grenade that damages enemies.,grenade,50,null,30,UISprites/Grenade